[
  {
    "schema_version": "1.0",
    "cell_id": "cpp__install-smoke__windows-x64__cpu",
    "run_id": "win-install",
    "sdk": "cpp",
    "feature": "install-smoke",
    "category": "packaging",
    "blocking": true,
    "model": null,
    "accelerator": "cpu",
    "result": "pass",
    "duration_seconds": 7.0,
    "env": {
      "platform_id": "windows-x64",
      "os": "windows",
      "arch": "x64",
      "hostname": "DESKTOP-4T800KF",
      "cpu": "Intel64 Family 6 Model 140 Stepping 1, GenuineIntel",
      "gpus": [
        "NVIDIA RTX A2000 Laptop GPU"
      ],
      "npu": null,
      "driver": null,
      "cuda": "Cuda compilation tools, release 13.3, V13.3.33",
      "runtimes": {
        "python": "3.11.9",
        "dotnet": "9.0.316",
        "node": "v24.13.0",
        "npm": null,
        "cmake": "cmake version 3.31.6-msvc6\n\nCMake suite maintained and supported by Kitware (kitware.com/cmake)."
      }
    },
    "package": {
      "name": "Microsoft.AI.Foundry.Local.Runtime",
      "version": "2.0.0-rc1",
      "resolved_source": "https://pkgs.dev.azure.com/aiinfra/PublicPackages/_packaging/ORT-Nightly/nuget/v3/index.json",
      "sha256": null,
      "native_lib_versions": {}
    },
    "assertions": [
      {
        "name": "package installs and reports RC version",
        "ok": true,
        "detail": "native lib present for win-x64: C:\\Code\\foundry-local\\validation\\results\\work-DESKTOP-4T800KF-win-install\\cpp__install-smoke__windows-x64__cpu\\cpp-smoke\\packages\\microsoft.ai.foundry.local.runtime\\2.0.0-rc1\\runtimes\\win-x64\\native\\foundry_local.dll"
      }
    ],
    "waiver": null,
    "log_path": "C:\\Code\\foundry-local\\validation\\results\\work-DESKTOP-4T800KF-win-install\\cpp__install-smoke__windows-x64__cpu\\install-smoke.log",
    "notes": "native lib present for win-x64: C:\\Code\\foundry-local\\validation\\results\\work-DESKTOP-4T800KF-win-install\\cpp__install-smoke__windows-x64__cpu\\cpp-smoke\\packages\\microsoft.ai.foundry.local.runtime\\2.0.0-rc1\\runtimes\\win-x64\\native\\foundry_local.dll",
    "owner": null,
    "timestamp": "2026-08-11T18:01:42+00:00"
  },
  {
    "schema_version": "1.0",
    "cell_id": "cs__install-smoke__windows-x64__cpu",
    "run_id": "win-install",
    "sdk": "cs",
    "feature": "install-smoke",
    "category": "packaging",
    "blocking": true,
    "model": null,
    "accelerator": "cpu",
    "result": "pass",
    "duration_seconds": 14.1,
    "env": {
      "platform_id": "windows-x64",
      "os": "windows",
      "arch": "x64",
      "hostname": "DESKTOP-4T800KF",
      "cpu": "Intel64 Family 6 Model 140 Stepping 1, GenuineIntel",
      "gpus": [
        "NVIDIA RTX A2000 Laptop GPU"
      ],
      "npu": null,
      "driver": null,
      "cuda": "Cuda compilation tools, release 13.3, V13.3.33",
      "runtimes": {
        "python": "3.11.9",
        "dotnet": "9.0.316",
        "node": "v24.13.0",
        "npm": null,
        "cmake": "cmake version 3.31.6-msvc6\n\nCMake suite maintained and supported by Kitware (kitware.com/cmake)."
      }
    },
    "package": {
      "name": "Microsoft.AI.Foundry.Local",
      "version": "2.0.0-rc1",
      "resolved_source": "https://pkgs.dev.azure.com/aiinfra/PublicPackages/_packaging/ORT-Nightly/nuget/v3/index.json",
      "sha256": null,
      "native_lib_versions": {}
    },
    "assertions": [
      {
        "name": "package installs and reports RC version",
        "ok": true,
        "detail": "restored+built Microsoft.AI.Foundry.Local 2.0.0-rc1 (win-x64)"
      }
    ],
    "waiver": null,
    "log_path": "C:\\Code\\foundry-local\\validation\\results\\work-DESKTOP-4T800KF-win-install\\cs__install-smoke__windows-x64__cpu\\install-smoke.log",
    "notes": "restored+built Microsoft.AI.Foundry.Local 2.0.0-rc1 (win-x64)",
    "owner": null,
    "timestamp": "2026-08-11T18:01:56+00:00"
  },
  {
    "schema_version": "1.0",
    "cell_id": "js__install-smoke__windows-x64__cpu",
    "run_id": "win-install",
    "sdk": "js",
    "feature": "install-smoke",
    "category": "packaging",
    "blocking": true,
    "model": null,
    "accelerator": "cpu",
    "result": "pass",
    "duration_seconds": 18.6,
    "env": {
      "platform_id": "windows-x64",
      "os": "windows",
      "arch": "x64",
      "hostname": "DESKTOP-4T800KF",
      "cpu": "Intel64 Family 6 Model 140 Stepping 1, GenuineIntel",
      "gpus": [
        "NVIDIA RTX A2000 Laptop GPU"
      ],
      "npu": null,
      "driver": null,
      "cuda": "Cuda compilation tools, release 13.3, V13.3.33",
      "runtimes": {
        "python": "3.11.9",
        "dotnet": "9.0.316",
        "node": "v24.13.0",
        "npm": null,
        "cmake": "cmake version 3.31.6-msvc6\n\nCMake suite maintained and supported by Kitware (kitware.com/cmake)."
      }
    },
    "package": {
      "name": "foundry-local-sdk",
      "version": "2.0.0-rc1",
      "resolved_source": "https://pkgs.dev.azure.com/aiinfra/PublicPackages/_packaging/ORT-Nightly/npm/registry/",
      "sha256": null,
      "native_lib_versions": {}
    },
    "assertions": [
      {
        "name": "package installs and reports RC version",
        "ok": true,
        "detail": "installed version=2.0.0-rc1"
      }
    ],
    "waiver": null,
    "log_path": "C:\\Code\\foundry-local\\validation\\results\\work-DESKTOP-4T800KF-win-install\\js__install-smoke__windows-x64__cpu\\install-smoke.log",
    "notes": "installed version=2.0.0-rc1",
    "owner": null,
    "timestamp": "2026-08-11T18:02:14+00:00"
  },
  {
    "schema_version": "1.0",
    "cell_id": "python__install-smoke__windows-x64__cpu",
    "run_id": "win-install",
    "sdk": "python",
    "feature": "install-smoke",
    "category": "packaging",
    "blocking": true,
    "model": null,
    "accelerator": "cpu",
    "result": "pass",
    "duration_seconds": 284.0,
    "env": {
      "platform_id": "windows-x64",
      "os": "windows",
      "arch": "x64",
      "hostname": "DESKTOP-4T800KF",
      "cpu": "Intel64 Family 6 Model 140 Stepping 1, GenuineIntel",
      "gpus": [
        "NVIDIA RTX A2000 Laptop GPU"
      ],
      "npu": null,
      "driver": null,
      "cuda": "Cuda compilation tools, release 13.3, V13.3.33",
      "runtimes": {
        "python": "3.11.9",
        "dotnet": "9.0.316",
        "node": "v24.13.0",
        "npm": null,
        "cmake": "cmake version 3.31.6-msvc6\n\nCMake suite maintained and supported by Kitware (kitware.com/cmake)."
      }
    },
    "package": {
      "name": "foundry-local-sdk",
      "version": "2.0.0rc1",
      "resolved_source": "https://pkgs.dev.azure.com/aiinfra/PublicPackages/_packaging/ORT-Nightly/pypi/simple/",
      "sha256": null,
      "native_lib_versions": {}
    },
    "assertions": [
      {
        "name": "package installs and reports RC version",
        "ok": true,
        "detail": "installed version=2.0.0rc1"
      }
    ],
    "waiver": null,
    "log_path": "C:\\Code\\foundry-local\\validation\\results\\work-DESKTOP-4T800KF-win-install\\python__install-smoke__windows-x64__cpu\\install-smoke.log",
    "notes": "installed version=2.0.0rc1",
    "owner": null,
    "timestamp": "2026-08-11T18:06:58+00:00"
  }
]